{
  "$schema": "../../schemas/skill-package.schema.json",
  "schemaVersion": 1,
  "id": "skill-creator",
  "entry": "SKILL.md",
  "agents": [
    "agents/openai.yaml"
  ],
  "references": [
    "references/progressive-disclosure.md",
    "references/eval-benchmarking.md",
    "references/package-contract.md"
  ],
  "templates": [
    "templates/skill-template.md",
    "templates/package-template.json",
    "templates/scenario-template.json"
  ],
  "examples": [
    "examples/create-db-migrator-skill.md"
  ],
  "evals": [
    "evals/scenarios.json"
  ],
  "scripts": []
}
