{
  "$schema": "../../schemas/skill-package.schema.json",
  "schemaVersion": 1,
  "id": "fable-config",
  "entry": "SKILL.md",
  "agents": [
    "agents/openai.yaml"
  ],
  "references": [
    "references/harness-configuration-rules.md"
  ],
  "templates": [],
  "examples": [
    "examples/configure-allowlist.md"
  ],
  "evals": [
    "evals/scenarios.json"
  ],
  "scripts": []
}
