{
  "$schema": "../../schemas/skill-package.schema.json",
  "schemaVersion": 1,
  "id": "fable-research",
  "entry": "SKILL.md",
  "agents": [
    "agents/openai.yaml"
  ],
  "references": [
    "references/primary-source-hierarchy.md"
  ],
  "templates": [],
  "examples": [
    "examples/research-api-specs.md"
  ],
  "evals": [
    "evals/scenarios.json"
  ],
  "scripts": []
}
